{
  "recipe_version": "1.0",
  "id": "can_family",
  "kind": "product",
  "units": "metres",
  "license": "Kentsugi project-generated",
  "bounds": [1.0, 1.0, 1.0],
  "construction": {
    "type": "radial_lathe",
    "axis": "z",
    "segments": 64,
    "profile": [
      [0.0, 0.43],
      [0.018, 0.45],
      [0.04, 0.475],
      [0.075, 0.495],
      [0.12, 0.5],
      [0.82, 0.5],
      [0.88, 0.495],
      [0.925, 0.475],
      [0.965, 0.445],
      [1.0, 0.435]
    ],
    "details": [
      { "type": "lid", "z": 0.995, "radius": 0.44 },
      { "type": "pull_tab", "z": 1.012, "length": 0.31 }
    ]
  },
  "material": {
    "fallback": {
      "base_color": [0.72, 0.035, 0.025],
      "metallic": 0.72,
      "roughness": 0.24
    },
    "palette": [
      [0.72, 0.035, 0.025],
      [0.82, 0.84, 0.86],
      [0.08, 0.09, 0.11]
    ],
    "textures": [],
    "uv_mapping": {
      "type": "cylindrical",
      "u_direction": 1,
      "u_offset": 0.0,
      "fit_confidence": 1.0,
      "v_profile": [[0.0, 0.0], [1.0, 1.0]]
    }
  },
  "editable_parameters": {
    "dimensions": {
      "description": "Catalog size [diameter_x, diameter_y, height] in metres",
      "standard": [0.066, 0.066, 0.122],
      "tall_energy": [0.066, 0.066, 0.168]
    },
    "shape": {
      "radius_curve": "Pairs of normalized height and radius multiplier, clamped to 0.5-1.5"
    },
    "details": {
      "lid_radius_scale": [0.5, 1.5],
      "pull_tab_scale": [0.5, 1.5]
    },
    "material": {
      "base_color": "linear RGB",
      "metallic": [0.0, 1.0],
      "roughness": [0.0, 1.0]
    }
  }
}

